No.,Time,Source,Destination,Protocol,Length,Info
1,0.000000,192.168.0.102,40.118.105.28,TLSv1.2,155,Application Data
2,0.070983,40.118.105.28,192.168.0.102,TLSv1.2,155,Application Data
3,0.115351,192.168.0.102,40.118.105.28,TCP,54,53866  >  443 [ACK] Seq=102 Ack=102 Win=254 Len=0
4,1.151415,162.125.18.133,192.168.0.102,TLSv1.2,311,Application Data
5,1.155169,192.168.0.102,162.125.18.133,TLSv1.2,753,Application Data
6,1.302201,162.125.18.133,192.168.0.102,TCP,56,443  >  55200 [ACK] Seq=258 Ack=700 Win=135 Len=0
7,1.319190,192.168.0.102,172.217.20.174,TCP,55,[TCP segment of a reassembled PDU]
8,1.375871,172.217.20.174,192.168.0.102,TCP,68,443  >  55468 [ACK] Seq=1 Ack=2 Win=208 Len=0 SLE=1 SRE=2
9,3.922573,216.58.209.206,192.168.0.102,TCP,56,443  >  55478 [FIN, ACK] Seq=1 Ack=1 Win=176 Len=0
10,3.922627,192.168.0.102,216.58.209.206,TCP,54,55478  >  443 [ACK] Seq=1 Ack=2 Win=257 Len=0
11,5.049220,172.217.20.174,192.168.0.102,TLSv1.2,117,Application Data
12,5.049618,192.168.0.102,172.217.20.174,TCP,54,55467  >  443 [FIN, ACK] Seq=1 Ack=64 Win=258 Len=0
13,5.063050,172.217.20.174,192.168.0.102,TCP,56,443  >  55467 [FIN, ACK] Seq=64 Ack=1 Win=181 Len=0
14,5.063106,192.168.0.102,172.217.20.174,TCP,54,55467  >  443 [ACK] Seq=2 Ack=65 Win=258 Len=0
15,5.102748,172.217.20.174,192.168.0.102,TCP,56,443  >  55467 [ACK] Seq=65 Ack=2 Win=181 Len=0
16,6.122432,192.168.0.102,157.56.52.19,UDP,78,23310  >  40008 Len=36
17,6.342555,157.56.52.19,192.168.0.102,UDP,489,40008  >  23310 Len=447
18,6.344850,192.168.0.102,157.55.235.156,UDP,183,23310  >  40039 Len=141
19,6.345043,192.168.0.102,157.55.235.156,UDP,183,23310  >  40039 Len=141
20,6.435580,157.55.235.156,192.168.0.102,UDP,94,40039  >  23310 Len=52
21,6.435581,157.55.235.156,192.168.0.102,UDP,94,40039  >  23310 Len=52
22,8.104381,2.106.13.73,192.168.0.102,UDP,60,47738  >  23310 Len=18
23,8.104928,192.168.0.102,2.106.13.73,UDP,68,23310  >  47738 Len=26
24,9.161397,2.106.13.73,192.168.0.102,UDP,60,47738  >  23310 Len=18
25,9.161813,192.168.0.102,2.106.13.73,UDP,68,23310  >  47738 Len=26
26,9.323487,192.168.0.102,104.46.38.64,TCP,54,55474  >  443 [FIN, ACK] Seq=1 Ack=1 Win=258 Len=0
27,9.323717,192.168.0.102,40.77.225.251,TCP,54,55475  >  443 [FIN, ACK] Seq=1 Ack=1 Win=258 Len=0
28,9.323777,192.168.0.102,40.76.12.4,TCP,54,55472  >  443 [FIN, ACK] Seq=1 Ack=1 Win=255 Len=0
29,9.411639,104.46.38.64,192.168.0.102,TCP,56,443  >  55474 [FIN, ACK] Seq=1 Ack=2 Win=510 Len=0
30,9.411695,192.168.0.102,104.46.38.64,TCP,54,55474  >  443 [ACK] Seq=2 Ack=2 Win=258 Len=0
31,9.487655,40.76.12.4,192.168.0.102,TCP,56,443  >  55472 [FIN, ACK] Seq=1 Ack=2 Win=510 Len=0
32,9.487712,192.168.0.102,40.76.12.4,TCP,54,55472  >  443 [ACK] Seq=2 Ack=2 Win=255 Len=0
33,9.519656,40.77.225.251,192.168.0.102,TCP,56,443  >  55475 [FIN, ACK] Seq=1 Ack=2 Win=513 Len=0
34,9.519712,192.168.0.102,40.77.225.251,TCP,54,55475  >  443 [ACK] Seq=2 Ack=2 Win=258 Len=0
35,9.585911,192.168.0.102,192.30.253.124,TCP,55,[TCP segment of a reassembled PDU]
36,9.740805,192.30.253.124,192.168.0.102,TCP,68,443  >  55310 [ACK] Seq=1 Ack=2 Win=31 Len=0 SLE=1 SRE=2
37,9.764606,2.106.13.73,192.168.0.102,UDP,60,47738  >  23310 Len=18
38,9.765036,192.168.0.102,2.106.13.73,UDP,68,23310  >  47738 Len=26
39,9.860045,2.106.13.73,192.168.0.102,UDP,60,47738  >  23310 Len=18
40,9.860472,192.168.0.102,2.106.13.73,UDP,68,23310  >  47738 Len=26
41,10.223601,2.106.13.73,192.168.0.102,UDP,60,47738  >  23310 Len=18
42,10.224002,192.168.0.102,2.106.13.73,UDP,68,23310  >  47738 Len=26
43,11.303054,192.168.0.102,198.252.206.25,TCP,55,[TCP segment of a reassembled PDU]
44,11.445815,198.252.206.25,192.168.0.102,TCP,68,443  >  55151 [ACK] Seq=1 Ack=2 Win=62 Len=0 SLE=1 SRE=2
45,15.873585,192.168.0.102,199.16.156.52,TCP,55,[TCP segment of a reassembled PDU]
46,16.055704,199.16.156.52,192.168.0.102,TCP,68,443  >  55424 [ACK] Seq=1 Ack=2 Win=131 Len=0 SLE=1 SRE=2
47,16.055705,172.217.20.174,192.168.0.102,TLSv1.2,117,Application Data
48,16.056106,192.168.0.102,172.217.20.174,TCP,54,55468  >  443 [FIN, ACK] Seq=2 Ack=64 Win=258 Len=0
49,16.064948,172.217.20.174,192.168.0.102,TCP,56,443  >  55468 [FIN, ACK] Seq=64 Ack=2 Win=208 Len=0
50,16.065003,192.168.0.102,172.217.20.174,TCP,54,55468  >  443 [ACK] Seq=3 Ack=65 Win=258 Len=0
51,16.108864,172.217.20.174,192.168.0.102,TCP,56,443  >  55468 [ACK] Seq=65 Ack=3 Win=208 Len=0
52,18.131755,192.168.0.102,192.30.253.125,TCP,55,[TCP segment of a reassembled PDU]
53,18.326001,192.30.253.125,192.168.0.102,TCP,68,443  >  54086 [ACK] Seq=1 Ack=2 Win=31 Len=0 SLE=1 SRE=2
54,21.635697,192.168.0.102,198.252.206.25,TCP,55,[TCP segment of a reassembled PDU]
55,21.782826,198.252.206.25,192.168.0.102,TCP,68,443  >  55187 [ACK] Seq=1 Ack=2 Win=62 Len=0 SLE=1 SRE=2
56,23.478388,157.55.235.176,192.168.0.102,TCP,60,40009  >  53868 [PSH, ACK] Seq=1 Ack=1 Win=83 Len=3
57,23.519426,192.168.0.102,157.55.235.176,TCP,54,53868  >  40009 [ACK] Seq=1 Ack=4 Win=256 Len=0
58,23.626429,157.55.235.176,192.168.0.102,TCP,72,40009  >  53868 [PSH, ACK] Seq=4 Ack=1 Win=83 Len=15
59,23.627158,192.168.0.102,67.238.37.176,TCP,66,55480  >  39292 [SYN] Seq=0 Win=64240 Len=0 MSS=1460 WS=256 SACK_PERM=1
60,23.627450,192.168.0.102,157.55.235.176,TCP,67,53868  >  40009 [PSH, ACK] Seq=1 Ack=19 Win=256 Len=13
61,23.627526,192.168.0.102,67.238.37.176,UDP,61,23310  >  39292 Len=19
62,23.710191,192.168.0.102,192.168.0.255,DB-LSP-DISC,174,Dropbox LAN sync Discovery Protocol
63,23.736385,157.55.235.176,192.168.0.102,TCP,56,40009  >  53868 [ACK] Seq=19 Ack=14 Win=83 Len=0
64,24.634304,192.30.253.124,192.168.0.102,TLSv1.2,88,Application Data
65,24.634665,192.168.0.102,192.30.253.124,TLSv1.2,89,Application Data
66,24.790832,192.30.253.124,192.168.0.102,TCP,56,443  >  55310 [ACK] Seq=32 Ack=37 Win=31 Len=0
67,26.646675,192.168.0.102,67.238.37.176,TCP,66,[TCP Retransmission] 55480  >  39292 [SYN] Seq=0 Win=64240 Len=0 MSS=1460 WS=256 SACK_PERM=1
68,28.795546,192.168.0.102,172.217.20.163,TCP,55,[TCP segment of a reassembled PDU]
69,28.849201,172.217.20.163,192.168.0.102,TCP,68,443  >  55471 [ACK] Seq=1 Ack=2 Win=187 Len=0 SLE=1 SRE=2
70,32.650802,192.168.0.102,67.238.37.176,TCP,66,[TCP Retransmission] 55480  >  39292 [SYN] Seq=0 Win=64240 Len=0 MSS=1460 WS=256 SACK_PERM=1
71,33.097749,192.168.0.102,64.233.161.188,TCP,55,53934  >  5228 [ACK] Seq=1 Ack=1 Win=254 Len=1
72,33.159162,192.30.253.125,192.168.0.102,TLSv1.2,88,Application Data
73,33.159163,64.233.161.188,192.168.0.102,TCP,68,5228  >  53934 [ACK] Seq=1 Ack=2 Win=180 Len=0 SLE=1 SRE=2
74,33.159526,192.168.0.102,192.30.253.125,TLSv1.2,89,Application Data
75,33.316293,192.30.253.125,192.168.0.102,TCP,56,443  >  54086 [ACK] Seq=32 Ack=37 Win=31 Len=0
76,36.453595,192.168.0.102,157.55.235.176,TCP,348,53868  >  40009 [PSH, ACK] Seq=14 Ack=19 Win=256 Len=294
77,36.560955,157.55.235.176,192.168.0.102,TCP,56,40009  >  53868 [ACK] Seq=19 Ack=308 Win=83 Len=0
78,36.560956,157.55.235.176,192.168.0.102,TCP,60,40009  >  53868 [PSH, ACK] Seq=19 Ack=308 Win=83 Len=4
79,36.616182,192.168.0.102,157.55.235.176,TCP,54,53868  >  40009 [ACK] Seq=308 Ack=23 Win=256 Len=0
80,39.316103,192.168.0.102,172.217.20.163,TCP,55,[TCP segment of a reassembled PDU]
81,39.369507,172.217.20.163,192.168.0.102,TCP,68,443  >  55479 [ACK] Seq=1 Ack=2 Win=180 Len=0 SLE=1 SRE=2
82,39.885218,192.168.0.102,216.58.209.206,TCP,55,[TCP segment of a reassembled PDU]
83,39.945924,216.58.209.206,192.168.0.102,TCP,68,443  >  55477 [ACK] Seq=1 Ack=2 Win=215 Len=0 SLE=1 SRE=2
84,43.371616,192.168.0.102,91.190.218.52,TCP,59,53847  >  12350 [PSH, ACK] Seq=1 Ack=1 Win=253 Len=5
85,43.474133,91.190.218.52,192.168.0.102,TCP,60,12350  >  53847 [PSH, ACK] Seq=1 Ack=6 Win=9 Len=5
86,43.518353,192.168.0.102,91.190.218.52,TCP,54,53847  >  12350 [ACK] Seq=6 Ack=6 Win=253 Len=0
87,48.829884,162.125.18.133,192.168.0.102,TLSv1.2,311,Application Data
88,48.833716,192.168.0.102,162.125.18.133,TLSv1.2,753,Application Data
89,48.936477,192.168.0.102,216.58.209.206,TCP,55,[TCP Keep-Alive] 55478  >  443 [ACK] Seq=0 Ack=2 Win=257 Len=1
90,48.984154,162.125.18.133,192.168.0.102,TCP,56,443  >  55200 [ACK] Seq=515 Ack=1399 Win=138 Len=0
91,48.984156,216.58.209.206,192.168.0.102,TCP,56,443  >  55478 [RST] Seq=2 Win=0 Len=0
92,50.659547,162.125.18.133,192.168.0.102,TLSv1.2,311,Application Data
93,50.663996,192.168.0.102,162.125.18.133,TLSv1.2,1060,Application Data
94,50.812771,162.125.18.133,192.168.0.102,TCP,56,443  >  55193 [ACK] Seq=258 Ack=1007 Win=185 Len=0
97,53.785566,192.168.0.102,192.168.0.255,DB-LSP-DISC,174,Dropbox LAN sync Discovery Protocol
98,55.002642,192.168.0.102,40.118.105.28,TLSv1.2,155,Application Data
99,55.077172,40.118.105.28,192.168.0.102,TLSv1.2,155,Application Data
100,55.118447,192.168.0.102,40.118.105.28,TCP,54,53866  >  443 [ACK] Seq=203 Ack=203 Win=254 Len=0
101,56.451359,192.168.0.102,198.252.206.25,TCP,55,[TCP Keep-Alive] 55151  >  443 [ACK] Seq=1 Ack=1 Win=253 Len=1
102,56.592853,198.252.206.25,192.168.0.102,TCP,68,[TCP Keep-Alive ACK] 443  >  55151 [ACK] Seq=1 Ack=2 Win=62 Len=0 SLE=1 SRE=2
103,61.058598,192.168.0.102,199.16.156.52,TCP,55,[TCP Keep-Alive] 55424  >  443 [ACK] Seq=1 Ack=1 Win=252 Len=1
104,61.217749,199.16.156.52,192.168.0.102,TCP,68,[TCP Keep-Alive ACK] 443  >  55424 [ACK] Seq=1 Ack=2 Win=131 Len=0 SLE=1 SRE=2
105,66.794296,192.168.0.102,198.252.206.25,TCP,55,[TCP Keep-Alive] 55187  >  443 [ACK] Seq=1 Ack=1 Win=253 Len=1
106,66.930965,198.252.206.25,192.168.0.102,TCP,68,[TCP Keep-Alive ACK] 443  >  55187 [ACK] Seq=1 Ack=2 Win=62 Len=0 SLE=1 SRE=2
107,69.799227,192.168.0.102,192.30.253.124,TCP,55,[TCP Keep-Alive] 55310  >  443 [ACK] Seq=36 Ack=32 Win=254 Len=1
108,69.951896,192.30.253.124,192.168.0.102,TCP,68,[TCP Keep-Alive ACK] 443  >  55310 [ACK] Seq=32 Ack=37 Win=31 Len=0 SLE=36 SRE=37
109,73.850486,192.168.0.102,172.217.20.163,TCP,55,[TCP Keep-Alive] 55471  >  443 [ACK] Seq=1 Ack=1 Win=256 Len=1
110,73.900228,172.217.20.163,192.168.0.102,TCP,68,[TCP Keep-Alive ACK] 443  >  55471 [ACK] Seq=1 Ack=2 Win=187 Len=0 SLE=1 SRE=2
111,75.824955,192.168.0.102,192.168.0.1,DNS,75,Standard query 0x521b A play.google.com
112,75.827345,192.168.0.1,192.168.0.102,DNS,112,Standard query response 0x521b A play.google.com CNAME play.l.google.com A 172.217.20.174
113,75.828087,192.168.0.102,172.217.20.174,TCP,66,55481  >  443 [SYN] Seq=0 Win=64240 Len=0 MSS=1460 WS=256 SACK_PERM=1
114,75.884455,172.217.20.174,192.168.0.102,TCP,68,443  >  55481 [SYN, ACK] Seq=0 Ack=1 Win=42780 Len=0 MSS=1380 SACK_PERM=1 WS=256
115,75.884635,192.168.0.102,172.217.20.174,TCP,54,55481  >  443 [ACK] Seq=1 Ack=1 Win=66048 Len=0
116,75.884941,192.168.0.102,172.217.20.174,TLSv1.2,571,Client Hello
117,75.931756,172.217.20.174,192.168.0.102,TCP,56,443  >  55481 [ACK] Seq=1 Ack=518 Win=44032 Len=0
118,75.931757,172.217.20.174,192.168.0.102,TLSv1.2,210,Server Hello, Change Cipher Spec, Encrypted Handshake Message
119,75.932145,192.168.0.102,172.217.20.174,TLSv1.2,105,Change Cipher Spec, Encrypted Handshake Message
120,75.934276,192.168.0.102,172.217.20.174,TLSv1.2,147,Application Data
121,75.934610,192.168.0.102,172.217.20.174,TLSv1.2,512,Application Data
122,75.977955,172.217.20.174,192.168.0.102,TCP,56,443  >  55481 [ACK] Seq=157 Ack=662 Win=44032 Len=0
123,75.977957,172.217.20.174,192.168.0.102,TLSv1.2,123,Application Data
124,75.978330,192.168.0.102,172.217.20.174,TLSv1.2,92,Application Data
125,75.991388,172.217.20.174,192.168.0.102,TLSv1.2,92,Application Data
126,76.000191,172.217.20.174,192.168.0.102,TLSv1.2,422,Application Data
127,76.000261,192.168.0.102,172.217.20.174,TCP,54,55481  >  443 [ACK] Seq=1158 Ack=632 Win=65536 Len=0
128,76.005957,192.168.0.102,172.217.20.174,TCP,66,55482  >  443 [SYN] Seq=0 Win=64240 Len=0 MSS=1460 WS=256 SACK_PERM=1
129,76.012651,172.217.20.174,192.168.0.102,TLSv1.2,100,Application Data
130,76.013091,192.168.0.102,172.217.20.174,TLSv1.2,100,Application Data
131,76.060886,172.217.20.174,192.168.0.102,TCP,68,443  >  55482 [SYN, ACK] Seq=0 Ack=1 Win=42780 Len=0 MSS=1380 SACK_PERM=1 WS=256
132,76.060887,172.217.20.174,192.168.0.102,TCP,56,443  >  55481 [ACK] Seq=678 Ack=1204 Win=45056 Len=0
133,76.061073,192.168.0.102,172.217.20.174,TCP,54,55482  >  443 [ACK] Seq=1 Ack=1 Win=66048 Len=0
134,76.061442,192.168.0.102,172.217.20.174,TLSv1.2,571,Client Hello
135,76.104705,172.217.20.174,192.168.0.102,TCP,56,443  >  55482 [ACK] Seq=1 Ack=518 Win=44032 Len=0
136,76.104707,172.217.20.174,192.168.0.102,TLSv1.2,214,Server Hello, Change Cipher Spec, Encrypted Handshake Message
137,76.105910,192.168.0.102,172.217.20.174,TLSv1.2,270,Change Cipher Spec, Encrypted Handshake Message, Encrypted Handshake Message
138,76.108478,192.168.0.102,172.217.20.174,TLSv1.2,147,Application Data
139,76.109018,192.168.0.102,172.217.20.174,TCP,1434,55482  >  443 [ACK] Seq=827 Ack=161 Win=66048 Len=1380 [TCP segment of a reassembled PDU]
140,76.109025,192.168.0.102,172.217.20.174,TLSv1.2,1219,Application Data
141,76.109109,192.168.0.102,172.217.20.174,TLSv1.2,855,Application Data
142,76.150559,172.217.20.174,192.168.0.102,TCP,56,443  >  55482 [ACK] Seq=161 Ack=827 Win=45056 Len=0
143,76.150560,172.217.20.174,192.168.0.102,TLSv1.2,123,Application Data
144,76.150857,192.168.0.102,172.217.20.174,TLSv1.2,92,Application Data
145,76.164678,172.217.20.174,192.168.0.102,TLSv1.2,92,Application Data
146,76.164679,172.217.20.174,192.168.0.102,TCP,56,443  >  55482 [ACK] Seq=268 Ack=4173 Win=53248 Len=0
147,76.178421,172.217.20.174,192.168.0.102,TLSv1.2,497,Application Data
148,76.178422,172.217.20.174,192.168.0.102,TLSv1.2,597,Application Data, Application Data
149,76.178497,192.168.0.102,172.217.20.174,TCP,54,55482  >  443 [ACK] Seq=4211 Ack=1254 Win=64768 Len=0
150,76.192679,172.217.20.174,192.168.0.102,TLSv1.2,100,Application Data
151,76.192751,192.168.0.102,172.217.20.174,TCP,54,55482  >  443 [ACK] Seq=4211 Ack=1300 Win=64768 Len=0
152,76.193119,192.168.0.102,172.217.20.174,TLSv1.2,100,Application Data
153,76.245679,172.217.20.174,192.168.0.102,TCP,56,443  >  55482 [ACK] Seq=1300 Ack=4211 Win=53248 Len=0
154,76.245680,172.217.20.174,192.168.0.102,TCP,56,443  >  55482 [ACK] Seq=1300 Ack=4257 Win=53248 Len=0
155,78.170977,192.168.0.102,64.233.161.188,TCP,55,[TCP Keep-Alive] 53934  >  5228 [ACK] Seq=1 Ack=1 Win=254 Len=1
156,78.244643,64.233.161.188,192.168.0.102,TCP,68,[TCP Keep-Alive ACK] 5228  >  53934 [ACK] Seq=1 Ack=2 Win=180 Len=0 SLE=1 SRE=2
157,78.324838,192.168.0.102,192.30.253.125,TCP,55,[TCP Keep-Alive] 54086  >  443 [ACK] Seq=36 Ack=32 Win=257 Len=1
158,78.481224,192.30.253.125,192.168.0.102,TCP,68,[TCP Keep-Alive ACK] 443  >  54086 [ACK] Seq=32 Ack=37 Win=31 Len=0 SLE=36 SRE=37
159,78.613861,192.168.0.102,239.255.255.250,SSDP,216,M-SEARCH * HTTP/1.1 
160,79.609714,192.168.0.102,239.255.255.250,SSDP,216,M-SEARCH * HTTP/1.1 
161,79.950975,192.168.0.1,224.0.0.1,IGMPv2,46,Membership Query, general
162,80.288488,192.168.0.102,239.255.255.250,IGMPv2,46,Membership Report group 239.255.255.250
163,80.610727,192.168.0.102,239.255.255.250,SSDP,216,M-SEARCH * HTTP/1.1 
164,81.612129,192.168.0.102,239.255.255.250,SSDP,216,M-SEARCH * HTTP/1.1 
165,81.790275,192.168.0.102,224.0.0.252,IGMPv2,46,Membership Report group 224.0.0.252
166,83.855002,192.168.0.102,192.168.0.255,DB-LSP-DISC,174,Dropbox LAN sync Discovery Protocol
167,84.379578,192.168.0.102,172.217.20.163,TCP,55,[TCP Keep-Alive] 55479  >  443 [ACK] Seq=1 Ack=1 Win=256 Len=1
168,84.434298,172.217.20.163,192.168.0.102,TCP,68,[TCP Keep-Alive ACK] 443  >  55479 [ACK] Seq=1 Ack=2 Win=180 Len=0 SLE=1 SRE=2
169,84.858913,192.30.253.124,192.168.0.102,TLSv1.2,88,Application Data
170,84.859208,192.168.0.102,192.30.253.124,TLSv1.2,89,Application Data
171,84.949741,192.168.0.102,216.58.209.206,TCP,55,[TCP Keep-Alive] 55477  >  443 [ACK] Seq=1 Ack=1 Win=258 Len=1
172,85.011627,216.58.209.206,192.168.0.102,TCP,68,[TCP Keep-Alive ACK] 443  >  55477 [ACK] Seq=1 Ack=2 Win=215 Len=0 SLE=1 SRE=2
173,85.011629,192.30.253.124,192.168.0.102,TCP,56,443  >  55310 [ACK] Seq=63 Ack=72 Win=31 Len=0
174,86.799553,192.168.0.102,224.0.0.251,IGMPv2,46,Membership Report group 224.0.0.251
175,87.924800,192.168.0.102,157.55.235.158,UDP,180,23310  >  40032 Len=138
176,87.925059,192.168.0.102,111.221.77.148,UDP,176,23310  >  40030 Len=134
177,88.013474,157.55.235.158,192.168.0.102,UDP,63,40032  >  23310 Len=21
178,88.084605,162.125.18.133,192.168.0.102,TLSv1.2,311,Application Data
179,88.089494,192.168.0.102,162.125.18.133,TLSv1.2,1060,Application Data
180,88.213614,111.221.77.148,192.168.0.102,UDP,63,40030  >  23310 Len=21
181,88.235027,162.125.18.133,192.168.0.102,TCP,56,443  >  55193 [ACK] Seq=515 Ack=2013 Win=189 Len=0
182,93.375990,192.30.253.125,192.168.0.102,TLSv1.2,88,Application Data
183,93.376366,192.168.0.102,192.30.253.125,TLSv1.2,89,Application Data
184,93.532071,192.30.253.125,192.168.0.102,TCP,56,443  >  54086 [ACK] Seq=63 Ack=72 Win=31 Len=0
185,96.525978,95.132.132.136,192.168.0.102,UDP,138,12962  >  23310 Len=96
186,96.526830,192.168.0.102,95.132.132.136,UDP,74,23310  >  12962 Len=32
187,96.554339,162.125.18.133,192.168.0.102,TLSv1.2,311,Application Data
188,96.558264,192.168.0.102,162.125.18.133,TLSv1.2,753,Application Data
189,96.706975,162.125.18.133,192.168.0.102,TCP,56,443  >  55200 [ACK] Seq=772 Ack=2098 Win=141 Len=0
190,98.938127,192.168.0.102,40.77.226.192,TLSv1.2,715,Application Data
191,99.033689,40.77.226.192,192.168.0.102,TLSv1.2,203,Application Data
192,99.083651,192.168.0.102,40.77.226.192,TCP,54,53843  >  443 [ACK] Seq=662 Ack=150 Win=253 Len=0
193,101.594536,192.168.0.102,198.252.206.25,TCP,55,[TCP Keep-Alive] 55151  >  443 [ACK] Seq=1 Ack=1 Win=253 Len=1
194,101.741970,198.252.206.25,192.168.0.102,TCP,68,[TCP Keep-Alive ACK] 443  >  55151 [ACK] Seq=1 Ack=2 Win=62 Len=0 SLE=1 SRE=2
195,103.415314,192.168.0.102,157.55.235.176,TCP,56,53868  >  40009 [PSH, ACK] Seq=308 Ack=23 Win=256 Len=2
196,103.562032,157.55.235.176,192.168.0.102,TCP,56,40009  >  53868 [ACK] Seq=23 Ack=310 Win=83 Len=0
197,103.562097,192.168.0.102,157.55.235.176,TCP,546,53868  >  40009 [PSH, ACK] Seq=310 Ack=23 Win=256 Len=492
198,103.670058,157.55.235.176,192.168.0.102,TCP,56,40009  >  53868 [ACK] Seq=23 Ack=802 Win=83 Len=0
199,103.670059,157.55.235.176,192.168.0.102,TCP,60,40009  >  53868 [PSH, ACK] Seq=23 Ack=802 Win=83 Len=4
200,103.710288,192.168.0.102,157.55.235.176,TCP,54,53868  >  40009 [ACK] Seq=802 Ack=27 Win=256 Len=0
201,103.998964,192.168.0.102,172.217.20.163,TLSv1.2,230,Application Data
202,103.999172,192.168.0.102,172.217.20.163,TLSv1.2,100,Application Data
203,104.075591,172.217.20.163,192.168.0.102,TCP,56,443  >  55471 [ACK] Seq=1 Ack=178 Win=197 Len=0
204,104.075592,172.217.20.163,192.168.0.102,TCP,56,443  >  55471 [ACK] Seq=1 Ack=224 Win=197 Len=0
205,104.075593,172.217.20.163,192.168.0.102,TLSv1.2,100,Application Data
206,104.116571,192.168.0.102,172.217.20.163,TCP,54,55471  >  443 [ACK] Seq=224 Ack=47 Win=256 Len=0
207,104.129455,172.217.20.163,192.168.0.102,TLSv1.2,215,Application Data
208,104.129456,172.217.20.163,192.168.0.102,TLSv1.2,300,Application Data
209,104.129536,192.168.0.102,172.217.20.163,TCP,54,55471  >  443 [ACK] Seq=224 Ack=454 Win=255 Len=0
210,104.143894,172.217.20.163,192.168.0.102,TLSv1.2,92,Application Data
211,104.143894,172.217.20.163,192.168.0.102,TLSv1.2,100,Application Data
212,104.143964,192.168.0.102,172.217.20.163,TCP,54,55471  >  443 [ACK] Seq=224 Ack=538 Win=254 Len=0
213,104.145021,192.168.0.102,172.217.20.163,TLSv1.2,100,Application Data
214,104.234297,172.217.20.163,192.168.0.102,TCP,56,443  >  55471 [ACK] Seq=538 Ack=270 Win=197 Len=0
215,104.333316,192.168.0.102,172.217.20.163,TLSv1.2,231,Application Data
216,104.382545,172.217.20.163,192.168.0.102,TCP,56,443  >  55471 [ACK] Seq=538 Ack=447 Win=207 Len=0
217,104.421821,172.217.20.163,192.168.0.102,TLSv1.2,131,Application Data
218,104.421822,172.217.20.163,192.168.0.102,TLSv1.2,299,Application Data
219,104.421926,192.168.0.102,172.217.20.163,TCP,54,55471  >  443 [ACK] Seq=447 Ack=860 Win=253 Len=0
220,104.435664,172.217.20.163,192.168.0.102,TLSv1.2,92,Application Data
221,104.435665,172.217.20.163,192.168.0.102,TLSv1.2,100,Application Data
222,104.435738,192.168.0.102,172.217.20.163,TCP,54,55471  >  443 [ACK] Seq=447 Ack=944 Win=258 Len=0
223,104.436759,192.168.0.102,172.217.20.163,TLSv1.2,100,Application Data
224,104.497257,172.217.20.163,192.168.0.102,TCP,56,443  >  55471 [ACK] Seq=944 Ack=493 Win=207 Len=0
225,104.526730,192.168.0.102,172.217.20.163,TLSv1.2,232,Application Data
226,104.578226,172.217.20.163,192.168.0.102,TCP,56,443  >  55471 [ACK] Seq=944 Ack=671 Win=218 Len=0
227,104.617899,172.217.20.163,192.168.0.102,TLSv1.2,108,Application Data
228,104.617901,172.217.20.163,192.168.0.102,TLSv1.2,336,Application Data, Application Data
229,104.617984,192.168.0.102,172.217.20.163,TCP,54,55471  >  443 [ACK] Seq=671 Ack=1280 Win=257 Len=0
230,104.630245,172.217.20.163,192.168.0.102,TLSv1.2,100,Application Data
231,104.630540,192.168.0.102,172.217.20.163,TLSv1.2,100,Application Data
232,104.682813,172.217.20.163,192.168.0.102,TCP,56,443  >  55471 [ACK] Seq=1326 Ack=717 Win=218 Len=0
233,106.217557,192.168.0.102,199.16.156.52,TCP,55,[TCP Keep-Alive] 55424  >  443 [ACK] Seq=1 Ack=1 Win=252 Len=1
234,106.378624,199.16.156.52,192.168.0.102,TCP,68,[TCP Keep-Alive ACK] 443  >  55424 [ACK] Seq=1 Ack=2 Win=131 Len=0 SLE=1 SRE=2
235,106.406931,192.168.0.102,172.217.20.163,TLSv1.2,243,Application Data
236,106.459370,172.217.20.163,192.168.0.102,TCP,56,443  >  55471 [ACK] Seq=1326 Ack=906 Win=228 Len=0
237,106.493461,172.217.20.163,192.168.0.102,TLSv1.2,131,Application Data
238,106.493462,172.217.20.163,192.168.0.102,TLSv1.2,339,Application Data, Application Data
239,106.493536,192.168.0.102,172.217.20.163,TCP,54,55471  >  443 [ACK] Seq=906 Ack=1688 Win=255 Len=0
240,106.506576,172.217.20.163,192.168.0.102,TLSv1.2,100,Application Data
241,106.506870,192.168.0.102,172.217.20.163,TLSv1.2,100,Application Data
242,106.559454,172.217.20.163,192.168.0.102,TCP,56,443  >  55471 [ACK] Seq=1734 Ack=952 Win=228 Len=0
243,106.587425,192.168.0.102,172.217.20.163,TLSv1.2,242,Application Data
244,106.638542,172.217.20.163,192.168.0.102,TCP,56,443  >  55471 [ACK] Seq=1734 Ack=1140 Win=238 Len=0
245,106.668657,172.217.20.163,192.168.0.102,TLSv1.2,108,Application Data
246,106.668658,172.217.20.163,192.168.0.102,TLSv1.2,340,Application Data, Application Data
247,106.668731,192.168.0.102,172.217.20.163,TCP,54,55471  >  443 [ACK] Seq=1140 Ack=2074 Win=254 Len=0
248,106.683173,172.217.20.163,192.168.0.102,TLSv1.2,100,Application Data
249,106.683594,192.168.0.102,172.217.20.163,TLSv1.2,100,Application Data
250,106.735010,172.217.20.163,192.168.0.102,TCP,56,443  >  55471 [ACK] Seq=2120 Ack=1186 Win=238 Len=0
251,106.753011,192.168.0.102,172.217.20.163,TLSv1.2,242,Application Data
252,106.802532,172.217.20.163,192.168.0.102,TCP,56,443  >  55471 [ACK] Seq=2120 Ack=1374 Win=248 Len=0
253,106.834397,172.217.20.163,192.168.0.102,TLSv1.2,108,Application Data
254,106.835413,172.217.20.163,192.168.0.102,TLSv1.2,334,Application Data, Application Data
255,106.835478,192.168.0.102,172.217.20.163,TCP,54,55471  >  443 [ACK] Seq=1374 Ack=2454 Win=258 Len=0
256,106.846623,172.217.20.163,192.168.0.102,TLSv1.2,100,Application Data
257,106.846956,192.168.0.102,172.217.20.163,TLSv1.2,100,Application Data
258,106.902703,172.217.20.163,192.168.0.102,TCP,56,443  >  55471 [ACK] Seq=2500 Ack=1420 Win=248 Len=0
259,106.913123,192.168.0.102,172.217.20.163,TLSv1.2,241,Application Data
260,106.962873,172.217.20.163,192.168.0.102,TCP,56,443  >  55471 [ACK] Seq=2500 Ack=1607 Win=259 Len=0
261,107.021107,172.217.20.163,192.168.0.102,TLSv1.2,109,Application Data
262,107.021108,172.217.20.163,192.168.0.102,TLSv1.2,277,Application Data
263,107.021218,192.168.0.102,172.217.20.163,TCP,54,55471  >  443 [ACK] Seq=1607 Ack=2778 Win=257 Len=0
264,107.034548,172.217.20.163,192.168.0.102,TLSv1.2,92,Application Data
265,107.034549,172.217.20.163,192.168.0.102,TLSv1.2,100,Application Data
266,107.034635,192.168.0.102,172.217.20.163,TCP,54,55471  >  443 [ACK] Seq=1607 Ack=2862 Win=257 Len=0
267,107.035625,192.168.0.102,172.217.20.163,TLSv1.2,100,Application Data
268,107.074809,172.217.20.163,192.168.0.102,TCP,56,443  >  55471 [ACK] Seq=2862 Ack=1653 Win=259 Len=0
269,107.091386,192.168.0.102,172.217.20.163,TLSv1.2,239,Application Data
270,107.142790,172.217.20.163,192.168.0.102,TCP,56,443  >  55471 [ACK] Seq=2862 Ack=1838 Win=269 Len=0
271,107.176600,172.217.20.163,192.168.0.102,TLSv1.2,108,Application Data
272,107.176602,172.217.20.163,192.168.0.102,TLSv1.2,273,Application Data
273,107.176676,192.168.0.102,172.217.20.163,TCP,54,55471  >  443 [ACK] Seq=1838 Ack=3135 Win=256 Len=0
274,107.186647,172.217.20.163,192.168.0.102,TLSv1.2,92,Application Data
275,107.186648,172.217.20.163,192.168.0.102,TLSv1.2,100,Application Data
276,107.186712,192.168.0.102,172.217.20.163,TCP,54,55471  >  443 [ACK] Seq=1838 Ack=3219 Win=255 Len=0
277,107.187572,192.168.0.102,172.217.20.163,TLSv1.2,100,Application Data
278,107.238666,172.217.20.163,192.168.0.102,TCP,56,443  >  55471 [ACK] Seq=3219 Ack=1884 Win=269 Len=0
279,107.251591,192.168.0.102,172.217.20.163,TLSv1.2,239,Application Data
280,107.303590,172.217.20.163,192.168.0.102,TCP,56,443  >  55471 [ACK] Seq=3219 Ack=2069 Win=279 Len=0
281,107.341262,172.217.20.163,192.168.0.102,TLSv1.2,109,Application Data
282,107.341264,172.217.20.163,192.168.0.102,TLSv1.2,313,Application Data, Application Data
283,107.341344,192.168.0.102,172.217.20.163,TCP,54,55471  >  443 [ACK] Seq=2069 Ack=3533 Win=254 Len=0
284,107.354607,172.217.20.163,192.168.0.102,TLSv1.2,100,Application Data
285,107.354896,192.168.0.102,172.217.20.163,TLSv1.2,100,Application Data
286,107.405107,192.168.0.102,172.217.20.163,TLSv1.2,238,Application Data
287,107.414337,172.217.20.163,192.168.0.102,TCP,56,443  >  55471 [ACK] Seq=3579 Ack=2115 Win=279 Len=0
288,107.454705,172.217.20.163,192.168.0.102,TCP,56,443  >  55471 [ACK] Seq=3579 Ack=2299 Win=289 Len=0
289,107.499032,172.217.20.163,192.168.0.102,TLSv1.2,131,Application Data
290,107.502016,172.217.20.163,192.168.0.102,TLSv1.2,312,Application Data, Application Data
291,107.502089,192.168.0.102,172.217.20.163,TCP,54,55471  >  443 [ACK] Seq=2299 Ack=3914 Win=258 Len=0
292,107.510783,172.217.20.163,192.168.0.102,TLSv1.2,100,Application Data
293,107.511111,192.168.0.102,172.217.20.163,TLSv1.2,100,Application Data
294,107.562859,172.217.20.163,192.168.0.102,TCP,56,443  >  55471 [ACK] Seq=3960 Ack=2345 Win=289 Len=0
295,107.595168,192.168.0.102,172.217.20.163,TLSv1.2,237,Application Data
297,107.624741,192.168.0.102,239.255.255.250,UDP,694,62500  >  3702 Len=652
299,107.625380,192.168.0.102,239.255.255.250,UDP,694,62500  >  3702 Len=652
300,107.646825,172.217.20.163,192.168.0.102,TCP,56,443  >  55471 [ACK] Seq=3960 Ack=2528 Win=300 Len=0
301,107.681954,172.217.20.163,192.168.0.102,TLSv1.2,109,Application Data
302,107.681955,172.217.20.163,192.168.0.102,TLSv1.2,309,Application Data, Application Data
303,107.682031,192.168.0.102,172.217.20.163,TCP,54,55471  >  443 [ACK] Seq=2528 Ack=4270 Win=257 Len=0
304,107.692993,192.168.0.102,239.255.255.250,UDP,694,62500  >  3702 Len=652
305,107.694626,172.217.20.163,192.168.0.102,TLSv1.2,100,Application Data
306,107.695011,192.168.0.102,172.217.20.163,TLSv1.2,100,Application Data
308,107.746881,172.217.20.163,192.168.0.102,TCP,56,443  >  55471 [ACK] Seq=4316 Ack=2574 Win=300 Len=0
310,107.827905,192.168.0.102,239.255.255.250,UDP,694,62500  >  3702 Len=652
311,107.840462,192.168.0.102,172.217.20.163,TLSv1.2,238,Application Data
312,107.845093,192.168.0.102,239.255.255.250,UDP,694,62500  >  3702 Len=652
314,107.893773,172.217.20.163,192.168.0.102,TCP,56,443  >  55471 [ACK] Seq=4316 Ack=2758 Win=310 Len=0
315,107.927298,172.217.20.163,192.168.0.102,TLSv1.2,148,Application Data
316,107.927299,172.217.20.163,192.168.0.102,TLSv1.2,384,Application Data, Application Data
317,107.927379,192.168.0.102,172.217.20.163,TCP,54,55471  >  443 [ACK] Seq=2758 Ack=4740 Win=255 Len=0
318,107.942844,172.217.20.163,192.168.0.102,TLSv1.2,100,Application Data
319,107.943165,192.168.0.102,172.217.20.163,TLSv1.2,100,Application Data
320,107.995584,172.217.20.163,192.168.0.102,TCP,56,443  >  55471 [ACK] Seq=4786 Ack=2804 Win=310 Len=0
322,108.096226,192.168.0.102,239.255.255.250,UDP,694,62500  >  3702 Len=652
324,108.284783,192.168.0.102,239.255.255.250,UDP,694,62500  >  3702 Len=652
326,108.754279,192.168.0.102,239.255.255.250,UDP,694,62500  >  3702 Len=652
327,108.825911,192.168.0.102,172.217.20.163,TLSv1.2,236,Application Data
328,108.875179,172.217.20.163,192.168.0.102,TCP,56,443  >  55471 [ACK] Seq=4786 Ack=2986 Win=320 Len=0
329,108.907354,172.217.20.163,192.168.0.102,TLSv1.2,128,Application Data
330,108.907355,172.217.20.163,192.168.0.102,TLSv1.2,296,Application Data
331,108.907433,192.168.0.102,172.217.20.163,TCP,54,55471  >  443 [ACK] Seq=2986 Ack=5102 Win=254 Len=0
332,108.923160,172.217.20.163,192.168.0.102,TLSv1.2,92,Application Data
333,108.923161,172.217.20.163,192.168.0.102,TLSv1.2,100,Application Data
334,108.923237,192.168.0.102,172.217.20.163,TCP,54,55471  >  443 [ACK] Seq=2986 Ack=5186 Win=253 Len=0
335,108.924117,192.168.0.102,172.217.20.163,TLSv1.2,100,Application Data
336,108.984284,172.217.20.163,192.168.0.102,TCP,56,443  >  55471 [ACK] Seq=5186 Ack=3032 Win=320 Len=0
337,109.010497,192.168.0.102,172.217.20.163,TLSv1.2,237,Application Data
338,109.063107,172.217.20.163,192.168.0.102,TCP,56,443  >  55471 [ACK] Seq=5186 Ack=3215 Win=330 Len=0
339,109.095489,172.217.20.163,192.168.0.102,TLSv1.2,109,Application Data
340,109.095490,172.217.20.163,192.168.0.102,TLSv1.2,324,Application Data, Application Data
341,109.095591,192.168.0.102,172.217.20.163,TCP,54,55471  >  443 [ACK] Seq=3215 Ack=5511 Win=258 Len=0
342,109.110964,172.217.20.163,192.168.0.102,TLSv1.2,100,Application Data
343,109.111401,192.168.0.102,172.217.20.163,TLSv1.2,100,Application Data
344,109.163428,157.55.235.176,192.168.0.102,TCP,60,40009  >  53868 [PSH, ACK] Seq=27 Ack=802 Win=83 Len=3
345,109.163430,172.217.20.163,192.168.0.102,TCP,56,443  >  55471 [ACK] Seq=5557 Ack=3261 Win=330 Len=0
346,109.203677,192.168.0.102,157.55.235.176,TCP,54,53868  >  40009 [ACK] Seq=802 Ack=30 Win=256 Len=0
347,109.310998,157.55.235.176,192.168.0.102,TCP,64,40009  >  53868 [PSH, ACK] Seq=30 Ack=802 Win=83 Len=10
348,109.311263,192.168.0.102,157.55.235.176,TCP,58,53868  >  40009 [PSH, ACK] Seq=802 Ack=40 Win=256 Len=4
349,109.455255,157.55.235.176,192.168.0.102,TCP,56,40009  >  53868 [ACK] Seq=40 Ack=806 Win=83 Len=0
350,109.596473,192.168.0.102,172.217.20.163,TLSv1.2,238,Application Data
351,109.647119,172.217.20.163,192.168.0.102,TCP,56,443  >  55471 [ACK] Seq=5557 Ack=3445 Win=341 Len=0
352,109.691585,172.217.20.163,192.168.0.102,TLSv1.2,128,Application Data
353,109.691586,172.217.20.163,192.168.0.102,TLSv1.2,337,Application Data, Application Data
354,109.691675,192.168.0.102,172.217.20.163,TCP,54,55471  >  443 [ACK] Seq=3445 Ack=5914 Win=257 Len=0
355,109.707076,172.217.20.163,192.168.0.102,TLSv1.2,100,Application Data
356,109.707370,192.168.0.102,172.217.20.163,TLSv1.2,100,Application Data
357,109.762194,172.217.20.163,192.168.0.102,TCP,56,443  >  55471 [ACK] Seq=5960 Ack=3491 Win=341 Len=0
358,110.003491,192.168.0.102,40.118.105.28,TLSv1.2,155,Application Data
359,110.077284,40.118.105.28,192.168.0.102,TLSv1.2,155,Application Data
360,110.117332,192.168.0.102,40.118.105.28,TCP,54,53866  >  443 [ACK] Seq=304 Ack=304 Win=254 Len=0
361,110.784737,192.168.0.102,162.125.66.3,TCP,54,54834  >  443 [RST, ACK] Seq=1 Ack=1 Win=0 Len=0
362,110.806178,192.168.0.102,192.168.0.1,DNS,81,Standard query 0xb17c A client-cf.dropbox.com
363,110.808472,192.168.0.1,192.168.0.102,DNS,130,Standard query response 0xb17c A client-cf.dropbox.com CNAME client.dropbox-dns.com A 162.125.66.3
364,110.809973,192.168.0.102,162.125.66.3,TCP,66,55483  >  443 [SYN] Seq=0 Win=64240 Len=0 MSS=1460 WS=256 SACK_PERM=1
365,110.863296,162.125.66.3,192.168.0.102,TCP,68,443  >  55483 [SYN, ACK] Seq=0 Ack=1 Win=28800 Len=0 MSS=1440 SACK_PERM=1 WS=512
366,110.863438,192.168.0.102,162.125.66.3,TCP,54,55483  >  443 [ACK] Seq=1 Ack=1 Win=66048 Len=0
367,110.864345,192.168.0.102,162.125.66.3,TLSv1.2,240,Client Hello
368,110.908107,162.125.66.3,192.168.0.102,TCP,56,443  >  55483 [ACK] Seq=1 Ack=187 Win=30208 Len=0
369,110.909730,162.125.66.3,192.168.0.102,TLSv1.2,1514,Server Hello
370,110.909732,162.125.66.3,192.168.0.102,TLSv1.2,1514,Certificate [TCP segment of a reassembled PDU]
371,110.909733,162.125.66.3,192.168.0.102,TLSv1.2,158,Server Key Exchange, Server Hello Done
372,110.909889,192.168.0.102,162.125.66.3,TCP,54,55483  >  443 [ACK] Seq=187 Ack=3025 Win=66048 Len=0
373,110.914328,192.168.0.102,162.125.66.3,TLSv1.2,180,Client Key Exchange, Change Cipher Spec, Encrypted Handshake Message
374,110.955823,162.125.66.3,192.168.0.102,TLSv1.2,328,New Session Ticket, Change Cipher Spec, Encrypted Handshake Message
375,110.959256,192.168.0.102,162.125.66.3,TLSv1.2,668,Application Data
376,111.060487,162.125.66.3,192.168.0.102,TCP,56,443  >  55483 [ACK] Seq=3299 Ack=927 Win=31232 Len=0
377,111.350939,192.168.0.102,172.217.20.163,TLSv1.2,339,Application Data
378,111.368090,192.168.0.102,172.217.20.163,TLSv1.2,384,Application Data
379,111.400291,172.217.20.163,192.168.0.102,TCP,56,443  >  55471 [ACK] Seq=5960 Ack=3776 Win=351 Len=0
380,111.417896,172.217.20.163,192.168.0.102,TCP,56,443  >  55471 [ACK] Seq=5960 Ack=4106 Win=361 Len=0
381,111.417897,172.217.20.163,192.168.0.102,TLSv1.2,123,Application Data
382,111.417897,172.217.20.163,192.168.0.102,TLSv1.2,100,Application Data
383,111.417898,162.125.66.3,192.168.0.102,TCP,1514,443  >  55483 [ACK] Seq=3299 Ack=927 Win=31232 Len=1460 [TCP segment of a reassembled PDU]
384,111.417899,162.125.66.3,192.168.0.102,TCP,1514,443  >  55483 [ACK] Seq=4759 Ack=927 Win=31232 Len=1460 [TCP segment of a reassembled PDU]
385,111.417900,162.125.66.3,192.168.0.102,TLSv1.2,1259,Application Data
386,111.417908,162.125.66.3,192.168.0.102,TCP,1514,443  >  55483 [ACK] Seq=7424 Ack=927 Win=31232 Len=1460 [TCP segment of a reassembled PDU]
387,111.417909,162.125.66.3,192.168.0.102,TCP,1514,443  >  55483 [ACK] Seq=8884 Ack=927 Win=31232 Len=1460 [TCP segment of a reassembled PDU]
388,111.417911,162.125.66.3,192.168.0.102,TLSv1.2,1514,Application Data [TCP segment of a reassembled PDU]
389,111.417912,162.125.66.3,192.168.0.102,TCP,1514,443  >  55483 [ACK] Seq=11804 Ack=927 Win=31232 Len=1460 [TCP segment of a reassembled PDU]
390,111.417913,162.125.66.3,192.168.0.102,TCP,1514,443  >  55483 [ACK] Seq=13264 Ack=927 Win=31232 Len=1460 [TCP segment of a reassembled PDU]
391,111.417914,162.125.66.3,192.168.0.102,TLSv1.2,189,Application Data
392,111.418210,192.168.0.102,172.217.20.163,TCP,54,55471  >  443 [ACK] Seq=4106 Ack=6075 Win=256 Len=0
393,111.418322,192.168.0.102,162.125.66.3,TCP,54,55483  >  443 [ACK] Seq=927 Ack=14859 Win=66048 Len=0
394,111.419621,192.168.0.102,172.217.20.163,TLSv1.2,100,Application Data
395,111.513900,172.217.20.163,192.168.0.102,TCP,56,443  >  55471 [ACK] Seq=6075 Ack=4152 Win=361 Len=0
396,111.655377,172.217.20.163,192.168.0.102,TLSv1.2,563,Application Data
397,111.655888,172.217.20.163,192.168.0.102,TLSv1.2,1484,Application Data
398,111.655889,172.217.20.163,192.168.0.102,TLSv1.2,1484,Application Data
399,111.655890,172.217.20.163,192.168.0.102,TLSv1.2,1484,Application Data
400,111.655895,172.217.20.163,192.168.0.102,TLSv1.2,1484,Application Data
401,111.655897,172.217.20.163,192.168.0.102,TLSv1.2,1484,Application Data
402,111.655992,192.168.0.102,172.217.20.163,TCP,54,55471  >  443 [ACK] Seq=4152 Ack=13734 Win=258 Len=0
403,111.662073,172.217.20.163,192.168.0.102,TLSv1.2,1484,Application Data
404,111.662075,172.217.20.163,192.168.0.102,TLSv1.2,1484,Application Data
405,111.662162,192.168.0.102,172.217.20.163,TCP,54,55471  >  443 [ACK] Seq=4152 Ack=16594 Win=258 Len=0
406,111.669736,192.168.0.102,172.217.20.163,TLSv1.2,513,Application Data
407,111.671050,172.217.20.163,192.168.0.102,TLSv1.2,1484,Application Data
408,111.671120,192.168.0.102,172.217.20.163,TCP,54,55471  >  443 [ACK] Seq=4611 Ack=18024 Win=258 Len=0
409,111.671912,172.217.20.163,192.168.0.102,TLSv1.2,1484,Application Data [TCP segment of a reassembled PDU]
410,111.671973,192.168.0.102,172.217.20.163,TCP,54,55471  >  443 [ACK] Seq=4611 Ack=19454 Win=258 Len=0
411,111.674737,172.217.20.163,192.168.0.102,TLSv1.2,1484,Application Data [TCP segment of a reassembled PDU]
412,111.674739,172.217.20.163,192.168.0.102,TLSv1.2,1484,Application Data [TCP segment of a reassembled PDU]
413,111.674821,192.168.0.102,172.217.20.163,TCP,54,55471  >  443 [ACK] Seq=4611 Ack=22314 Win=258 Len=0
414,111.680705,172.217.20.163,192.168.0.102,TLSv1.2,1484,Application Data [TCP segment of a reassembled PDU]
415,111.680707,172.217.20.163,192.168.0.102,TLSv1.2,1484,Application Data [TCP segment of a reassembled PDU]
416,111.680783,192.168.0.102,172.217.20.163,TCP,54,55471  >  443 [ACK] Seq=4611 Ack=25174 Win=258 Len=0
417,111.685314,172.217.20.163,192.168.0.102,TLSv1.2,1484,Application Data [TCP segment of a reassembled PDU]
418,111.685412,192.168.0.102,172.217.20.163,TCP,54,55471  >  443 [ACK] Seq=4611 Ack=26604 Win=258 Len=0
419,111.686783,172.217.20.163,192.168.0.102,TLSv1.2,1484,Application Data [TCP segment of a reassembled PDU]
420,111.686824,192.168.0.102,172.217.20.163,TCP,54,55471  >  443 [ACK] Seq=4611 Ack=28034 Win=258 Len=0
421,111.691637,172.217.20.163,192.168.0.102,TLSv1.2,1484,Application Data [TCP segment of a reassembled PDU]
422,111.691712,192.168.0.102,172.217.20.163,TCP,54,55471  >  443 [ACK] Seq=4611 Ack=29464 Win=258 Len=0
423,111.692978,172.217.20.163,192.168.0.102,TLSv1.2,1484,Application Data [TCP segment of a reassembled PDU]
424,111.693021,192.168.0.102,172.217.20.163,TCP,54,55471  >  443 [ACK] Seq=4611 Ack=30894 Win=258 Len=0
425,111.697624,172.217.20.163,192.168.0.102,TLSv1.2,1484,Application Data [TCP segment of a reassembled PDU]
426,111.697680,192.168.0.102,172.217.20.163,TCP,54,55471  >  443 [ACK] Seq=4611 Ack=32324 Win=258 Len=0
427,111.701085,172.217.20.163,192.168.0.102,TLSv1.2,1484,Application Data [TCP segment of a reassembled PDU]
428,111.701129,192.168.0.102,172.217.20.163,TCP,54,55471  >  443 [ACK] Seq=4611 Ack=33754 Win=258 Len=0
429,111.702821,172.217.20.163,192.168.0.102,TLSv1.2,1484,Application Data [TCP segment of a reassembled PDU]
430,111.702824,172.217.20.163,192.168.0.102,TLSv1.2,1484,Application Data [TCP segment of a reassembled PDU]
431,111.702860,192.168.0.102,172.217.20.163,TCP,54,55471  >  443 [ACK] Seq=4611 Ack=36614 Win=258 Len=0
432,111.708757,172.217.20.163,192.168.0.102,TLSv1.2,1484,Application Data [TCP segment of a reassembled PDU]
433,111.708759,172.217.20.163,192.168.0.102,TLSv1.2,1484,Application Data [TCP segment of a reassembled PDU]
434,111.708760,172.217.20.163,192.168.0.102,TLSv1.2,883,Application Data, Application Data
435,111.708836,192.168.0.102,172.217.20.163,TCP,54,55471  >  443 [ACK] Seq=4611 Ack=40303 Win=258 Len=0
436,111.719697,172.217.20.163,192.168.0.102,TCP,56,443  >  55471 [ACK] Seq=40303 Ack=4611 Win=372 Len=0
437,111.749771,172.217.20.163,192.168.0.102,TLSv1.2,100,Application Data
438,111.749773,172.217.20.163,192.168.0.102,TLSv1.2,92,Application Data
439,111.749773,172.217.20.163,192.168.0.102,TLSv1.2,100,Application Data
440,111.749860,192.168.0.102,172.217.20.163,TCP,54,55471  >  443 [ACK] Seq=4611 Ack=40433 Win=258 Len=0
441,111.750762,192.168.0.102,172.217.20.163,TLSv1.2,100,Application Data
442,111.845982,172.217.20.163,192.168.0.102,TCP,56,443  >  55471 [ACK] Seq=40433 Ack=4657 Win=372 Len=0
443,111.931956,192.168.0.102,198.252.206.25,TCP,55,[TCP Keep-Alive] 55187  >  443 [ACK] Seq=1 Ack=1 Win=253 Len=1
444,112.068623,198.252.206.25,192.168.0.102,TCP,68,[TCP Keep-Alive ACK] 443  >  55187 [ACK] Seq=1 Ack=2 Win=62 Len=0 SLE=1 SRE=2
445,112.273075,192.168.0.102,192.168.0.1,DNS,78,Standard query 0xe6be A www.googleapis.com
